review_no,goods_no,grade,content,size_option,like_count,has_image,user_height,user_weight,created_at
83320196,4982686,5,가볍고 쿠션감 좋네요 디자인도 깔끔합니다 다만 끈이 좀 길어요,02_White/Black · 245,0,True,0,0,2026-03-30T16:40:06.000+09:00
83255815,4982686,5,신발을 신었을 때의 가벼움과 편안함이 공존해서 좋습니다 운동할 때 자주 신을 것 같아요.,02_White/Black · 265,0,True,0,0,2026-03-27T14:01:56.000+09:00
83255769,4982686,5,신발 자체가 가볍고 착용감이 좋아서 운동 할 때 신으면 좋을 것 같습니다. 지금같이 시원한 날씨에 신어도 좋을 것 같아요.,02_White/Black · 265,0,True,0,0,2026-03-27T13:59:32.000+09:00
82501571,4982686,4,런닝하려고 구매했어요 바닥도 푹신하고 통통튀는? 느낌이라 런닝하기 좋을것 같아요!,02_White/Black · 220,0,True,0,0,2026-02-23T22:21:23.000+09:00
82166248,4982686,5,"신발 픽업한날 신나서 바로 3m달려버리기. 두꺼운 스포츠 양말을 신으니 조금큰 사이즈가 커버 됩니다. 물론 발가락도 좀 남고, 발볼도 좀 남으나 끈으로 조이니 덜컹 인다거나 달릴 때 불편함은 없었어요. 오히려 넉넉하게 사서 발 조이는 느낌도 없고 잘산것 같아요^0^ 역시 신어 봐야해!
1. 초보자가 신기에 발목을 잡아준다. 
2. 적당히 품신해서 무릎에 무리가 가지 않는다.
3. 밑창이 넓어 안정적이|다.",02_White/Black · 250,0,True,0,0,2026-02-12T13:09:32.000+09:00
82166174,4982686,5,"1. 초보자가 신기에 발목을 잡아준다. 
2. 적당히 품신해서 무릎에 무리가 가지 않는다.
3. 밑창이 넓어 안정적이|다.",02_White/Black · 250,0,True,0,0,2026-02-10T18:12:00.000+09:00
83666354,4982686,4,쿠셔닝이 좋고 런닝도 뛰어 봤는대 발이 확실히 편합니다,02_White/Black · 275,0,True,0,0,2026-04-14T10:58:54.000+09:00
83540923,4982686,5,생각보다 싼티가 마니나요 편한것도 잘 모르겟어요,02_White/Black · 250,0,True,0,0,2026-04-08T20:49:37.000+09:00
79167532,4982686,5,미즈노 2개째인데 러닝화 하나 더 사려구요. 가벼운 러닝까지만 딱 좋아요 다른 운동할땐 만능입니다,02_White/Black · 260,1,True,0,0,2025-10-20T10:23:42.000+09:00
84019239,4982686,5,"아주 고급스러운 느낌은 아니야. 근데 아웃솔은 튼튼하고 훌륭해. 
인솔도 괜찮고... 뛰었을 때 나이키의 트레이너화들 보다는 훨씬 가볍고 착화감이 좋아.",02_White/Black · 275,0,False,0,0,2026-04-28T12:58:13.000+09:00
83985236,4982686,5,포장도 아주 깔끔하고 상품 상태가 완벽해요 정말 감사해요,02_White/Black · 265,0,False,0,0,2026-04-26T22:00:52.000+09:00
83428244,4982686,5,일단 발볼이 넓고 기본사이즈가 큰 편이라 정사이즈로 사시는걸 추천드립니다. 가볍고 발목을 잘 잡아줘서 운동할 때 편합니다,02_White/Black · 245,0,False,0,0,2026-04-03T23:02:58.000+09:00
83624486,5882655,5,할인해서 잘샀습니다 신발도 배송도 빠르고 좋네요,245,0,True,0,0,2026-04-12T14:49:53.000+09:00
83701196,5882655,5,신발이 가볍고 통통 튀면서 폭신해서 발전체가 편안합니다 포인트 되는 밑창부위 살구색이 너무 이뻐요,250,0,False,0,0,2026-04-15T15:56:13.000+09:00
83638393,5882655,5,"쿠셔닝이 좋아요, 러닝할때 발목에 부담감리 덜하고 속도도 잘나요.",225,0,False,0,0,2026-04-13T00:40:01.000+09:00
83384403,4172869,5,런닝용도로 샀어요. 가볍고 뛰기 좋아요. 발볼이 넓은편이라 반사이즈 업했더니 딱 좋습니다.,255,2,True,0,0,2026-04-02T08:28:10.000+09:00
83865816,4172869,5,남자친구 선물로 가볍고 편한 신발 찾고있었는데 딱이네요! 매우 만족스러워하면서 신고있습니다,265,0,True,0,0,2026-04-22T00:05:27.000+09:00
83774807,4172869,5,좀 작게 나왔다는 말이 맞네요 평소 260 신는데 265 주문하니 딱 맞아요! 가볍고 쿠션감도 좋고 무엇보다 진짜 저렴하게 잘 샀어요,265,0,True,0,0,2026-04-18T14:45:44.000+09:00
83751487,4172869,5,가벼운 조깅하기에 딱 좋아요. 괜히 조깅화로 유명한게 아니네요,265,0,True,0,0,2026-04-17T15:01:07.000+09:00
83751334,4172869,5,가벼운 조깅하기에 딱 좋아요. 괜히 조깅화로 유명한게 아니네요,255,0,True,0,0,2026-04-17T14:54:52.000+09:00
83411151,4172869,5,요새 러닝을 시작해서 사봤는데 바닥에 닿을 때마다 발이 편하고 좋아요.,255,0,True,0,0,2026-04-03T09:01:02.000+09:00
83309930,4172869,5,가볍고 착용감이 좋습니다 런닝화로 좋을 것 같아요,265,0,True,0,0,2026-03-30T00:15:31.000+09:00
83238650,4172869,5,런닝화 입문템으로 유명해서 구매했는데 진짜 편하고 좋아요. 사이즈 반업 필수!!,255,0,True,0,0,2026-03-26T17:48:19.000+09:00
83053796,4172869,5,쿠션감 좋고 착화감 편해서 데일리 러닝화로 만족함,255,0,True,0,0,2026-03-18T21:07:19.000+09:00
80022987,4172869,5,이거신고 10K 마라톤 했습니다 ! 10키로는 아주 거뜬히 뛸 수 있어요 사이즈는 1업 했는데도 꽉 맞아요 발볼 보통인데 1업이 딱 맞는 느낌이어서 진짜 기본으로 1업 해야하는거 같아요 필수!! 더 넉넉하게 신고 싶다면 2업 하면 될듯,255,2,True,0,0,2025-11-20T07:39:17.000+09:00
78451904,4172869,5,착화감이 좋고 런닝할때 특히 발바닥 쿠션감이 딱 적당해서 평발가까운 발바닥에 너무 편했습니다,255,1,True,0,0,2026-01-21T01:14:41.000+09:00
81002929,4172869,5,정신을 건강하게 하려면 러닝을 해야하는데 러닝을 하려면 러닝화가 필요해서 입문용으로 구매했는데 너무 가볍고 좋습니다 근데 정말 입문용이라는점 참고하세요 !,240,1,True,0,0,2025-12-14T22:34:28.000+09:00
79500502,4172869,5,10키로 마라톤 준비 하려고 샀어요. 전에 신발보다 확실히 편합니다. 그리고 가볍고 좋은데 싸이즈는 좀 작은 거 같아요 1업 했는데도 꽉맞아요 그래도 전 신발보다 확실히 편해서 다 신고 있습니다. 다른 쿠션화는 오히려 너무 폭신 해서 부담스러웠는데 이건 적당해요,255,1,True,0,0,2025-11-01T10:21:07.000+09:00
78252315,4172869,5,"헬스 다니면서 신으려고 급하게 주문했는데
배송도 빠르게오고 신발도 너무 편해서 좋아요!!!
평소에 230 신는데 235 반업 하니까 딱이에요",235,1,True,0,0,2025-09-11T22:46:36.000+09:00
77745787,4172869,5,엄마 선물로 화이트 구매하고 마음에 들어서 블랙까지 구입했어요 엄마가 평소에도 나이키 신발을 좋아하는데 확실히 가볍고 에어가 있어서 착화감도 좋아요 다른 기능성 운동화보다 편하다고 하시네요,245,1,True,0,0,2025-08-20T10:20:39.000+09:00
83817982,4172869,5,다음에도 또 구매하고 싶은 정말 좋은 제품이에요 만족해요,265,0,False,0,0,2026-04-20T07:30:34.000+09:00
83776190,4172869,5,어디에나 잘어울려요 기본템으로 아주 좋아요 강추용,265,0,False,0,0,2026-04-18T15:33:59.000+09:00
83731648,4172869,5,배송이 엄청 빠릅니다. 예쁘구요 스타일이 좋아요~,255,0,False,0,0,2026-04-16T18:37:00.000+09:00
83717317,4172869,5,빠른 배송 정말 감사드려요 물건도 너무 좋아요 만족해요,255,0,False,0,0,2026-04-16T02:13:40.000+09:00
83674585,4172869,5,합리적인 가격에 아주 좋은 품질이라 정말 매우 만족합니다,265,0,False,0,0,2026-04-14T17:35:49.000+09:00
83141766,4425597,5,디자인이 깔끔하고 컬러 은은해요 편하고 가성비 좋습니다,240,0,True,0,0,2026-03-22T15:19:54.000+09:00
81968026,4425597,4,색상이랑 외관은 이쁩니다! 쿠션이 있진않고 안전화신는 느낌이에요. 통풍이 안되므로 여름에 신긴힘들것 같아요,280,1,True,0,0,2026-01-30T23:09:00.000+09:00
65697586,4425597,5,배송이 빠르고 사진이랑 똑같습니다. 색감도 좋고 튼튼해 보여요.,265,1,True,0,0,2024-10-17T18:47:44.000+09:00
83005818,4425597,5,"아주 이쁜거 싸게.잘 삿어요
맘에듭니다 ㅋㅋ 잘신을게요",270,0,False,0,0,2026-03-17T02:59:41.000+09:00
70735330,4425597,5,길이는 딱 맞지만 넓이는 좀 좁아서 한사이즈 크게 사는게 좋겠네요,265,0,False,0,0,2025-02-04T12:20:01.000+09:00
69855765,4425597,4,가볍고 디자인도 깔끔해서 잘 산 것 같습니다. 감사합니다.,265,0,False,0,0,2025-01-10T23:25:33.000+09:00
69411611,4425597,5,사이즈 자체는 신었을때 딱 맞지만 신발을 다 신기까지가 조금 힘드네요,265,0,False,0,0,2024-12-29T11:35:01.000+09:00
65379403,4425597,4,실물이 훨씬 깡패네요 다만 칼발용으로 나왔어서 한치수 더 키우거나 혹은 고려 하시고 구매하실 때 참고하면 좋겠네요~,275,0,False,0,0,2024-10-09T08:46:42.000+09:00
83452454,5042974,5,너무 가볍고 푹신푹신해서 평소 뛰던 러닝화보다 기록 잘 나오네요 이거 신고 첫 10키로 마라톤 55분대로 뛰었습니다 블랙에 실버 조합 간지....,230,2,True,0,0,2026-04-05T00:49:31.000+09:00
83452421,5042974,5,너무 가볍고 푹신푹신해서 평소 뛰던 러닝화보다 기록 잘 나오네요 이거 신고 첫 10키로 마라톤 55분대로 뛰었습니다 블랙에 실버 조합 간지....,230,1,True,0,0,2026-04-05T00:47:20.000+09:00
83997478,5042974,5,평소 230 신고 오후에는 발이 붓는 편이라 반업했어요. 아주 살짝 여유로운 정도라 헐렁거리지 않고 편하게 잘 맞아서 반업하길 잘 한 것 같아요. 매우 가볍고 쿠션감도 좋네요. 초보 러너인데 잘 신겠습니다.,235,0,True,0,0,2026-04-27T12:54:23.000+09:00
83929186,5042974,5,흰색 잘 신고 있어서 교대로 신으려고 검정도 구매햇어요. 맘에들어요,240,0,True,0,0,2026-04-24T13:50:25.000+09:00
83897172,5042974,5,"페가수스 41 신다가 갈아탔습니다~! 왜 이제야 산지 모르겠음 ..
개가볍고 통통 튀는게 뛸 때 기분이 넘 좋습니다 굿

아 다만 찐덕거리는 무언가가 묻어왔어요 .. 물티슈로 지워도 안 지워져서 칫솔로 개 빡빡 닦으니까 지워짐",250,0,True,0,0,2026-04-23T04:29:23.000+09:00
83861969,5042974,5,"초보에겐 성능보다 '나가고 싶게 만드는 디자인'이 중요한데, 이건 그냥 최고입니다. 운동복은 물론 일상복에도 잘 어울려서, 신발장에 놓인 모습만 봐도 ""오늘 한 번 뛰어볼까?"" 하는 동기부여가 확실히 됩니다.
발바닥이 지면에 닿을 때마다 충격이 걱정되는데, 이 신발은 쿠션이 정말 쫀득합니다. 너무 딱딱하지도, 너무 푹 꺼지지도 않아서 무릎에 전해지는 부담이 확실히 덜한 느낌이에요.",250,0,True,0,0,2026-04-21T22:23:34.000+09:00
83808224,5042974,5,"직접 신어보니까 왜 데일리 러닝화로 많이 추천하는지 알겠습니당!! 

일단 가장 마음에 드는 건 가벼운 착화감입니다~
신자마자 발에 부담이 거의 없어서 처음 뛰는 순간부터 편안하게느껴졌어요
그리고 쿠셔닝이 생각보다 탄탄해서
푹신하기만 한 게 아니라 적당히 반발력이 있어서 발이 앞으로 자연스럽게 밀리는 느낌이 들어서 러닝 리듬 잡기 좋았습니다👍🏻

디자인도 깔끔해서
운동할 때뿐 아니라 평소 데일리룩에도 잘 어울리네용><!!
넘 만족합니다!!!",240,0,True,0,0,2026-04-19T20:58:04.000+09:00
83718556,5042974,5,배송 빨랐고요 신발 너무 예쁘고 착화감도 좋습니다 어디든 잘 어울려요 또 사러 올게요,240,0,True,0,0,2026-04-16T07:31:43.000+09:00
83557167,5042974,5,배송 빨랐구요~ 신발 너무 이쁘고 맘에 듭니다 착화감도 너무 좋아요~ 또 사러 올께요,240,0,True,0,0,2026-04-09T14:38:17.000+09:00
83468819,5042974,5,편하게 잘 사용하고 있어요~!저렴하게 구매했어요 추천합니다,230,0,True,0,0,2026-04-05T20:39:33.000+09:00
82859822,5042974,5,"부모님 선물로 드렸는데 너무 조아하시네용
가격이 비싼데는 이유가 있어요
저는 생각보다 너무 가벼워서 발을 잘 못잡아주진 않을까 생각했는데
부모님 발에는 괜찮다고 하시네요",245,1,True,0,0,2026-03-10T22:03:24.000+09:00
83272322,5042974,5,"아디다스 아디제로 EVO SL W - 블랙은 정말 가볍고 발이 편해서 러닝, 걷기운동할 때 신기 좋은 운동화 스니커즈 입니다.",240,0,True,0,0,2026-03-28T10:49:09.000+09:00
83072968,5042974,5,"아디다스 아디제로 EVO는 가볍고, 미끄럽지않고, 그리고 블랙컬러라서 데일리로 신어도 좋은 운동화 입니다.",240,0,True,0,0,2026-03-19T16:07:11.000+09:00
83010997,5042974,5,"비가와서 사두고 아직 개시는 안했지만
후기도 좋고 매장에서 신어봤었는데 너무 가볍고 편했어요
얼른 러닝하고싶네요!",240,0,True,0,0,2026-03-17T12:56:13.000+09:00
82961798,5042974,5,정말 잘신거있어요 가볍고 편해서 러닝화 정착해써용,245,0,True,0,0,2026-03-15T09:00:54.000+09:00
82954494,5042974,5,"배송빠르고 무엇보다 너무 가벼워요
그리고 통풍도 잘되는거 같아요",240,0,True,0,0,2026-03-14T21:07:47.000+09:00
82952020,5042974,5,"배송도 빠르고 착화감이 좋습니다
그리고 무엇보다 엄청 가벼워요",240,0,True,0,0,2026-03-14T19:14:01.000+09:00
82940310,5042974,5,일상화로 신어도 편하고 일단 통통 튀는 느낌이라서 너무너무 편해요!,225,0,True,0,0,2026-03-14T09:56:14.000+09:00
82924390,5042974,5,"신발 너무 예뻐요
색도 맘에들고 착용감도 괜찮아요
얼른신고 뛰고싶네요",225,0,True,0,0,2026-03-13T15:04:31.000+09:00
82908910,5042974,5,"일단 가볍고 편해요. 뛸 때 미끄러운 느낌이 조금 있었는데 양말을 바꿔서 다시 뛰어볼께요
10km만 뛰어봤는데 좀 더 길게 뛰어봐야 겠어요.",240,0,True,0,0,2026-03-12T20:38:24.000+09:00
83891515,6246970,5,"일단 너무가볍고 다른 러닝화에 비해 데일리화 느낌이 좀더 납니다, 착화감 좋은데 바닥이 많이 말랑하진 않아요 그래서 더 좋습니다, 데일리+러닝화",275,0,True,0,0,2026-04-22T22:20:46.000+09:00
83928582,6246970,5,색감 디자인 착화감 너무 마음에 들어요! 구매 잘 한 거 같아요!,280,0,True,0,0,2026-04-24T13:19:37.000+09:00
83877697,6246970,3,신발자체는 이쁜데 일반적인 러닝화에 비에 살짝 둔탁하고 무거운 느낌이 약간있습니다.일반적인 아식스 운동화 정도?발등이 좀 쪼이는 느낌도 살짝있고 발볼은 좋은데 전체적으로 답답한 느낌은 있습니다.그래도 바닥제질이좋아 만족합니다.,255,0,False,0,0,2026-04-22T14:18:30.000+09:00
83870889,6246970,5,"디자인 너무 예쁘고, 색감이 너무 예뻐서 좋아요 완전 만족합니다",255,0,False,0,0,2026-04-22T09:05:33.000+09:00
83799659,6246970,5,정말좋아요 다들구매하세요 사이즈는 반업했어요,260,0,False,0,0,2026-04-19T15:20:43.000+09:00
83744736,6246970,5,우선 디자인이 맘에 들고 발을 안정적으로 잡아주어서 러닝이나 운동시에 매우 편함,250,0,False,0,0,2026-04-17T09:08:47.000+09:00
69740312,4298289,5,배송빠르게 잘받았어요~신발 가볍고 착용감 너무 좋습니다~265신는데 후기보고 반업해서 270구매했는데 딱 좋네요^^,270,1,True,0,0,2025-01-07T21:39:44.000+09:00
63932768,4298289,5,"사이즈는 발등,발볼높으면 1업이 답이네요. 반업은 너무 딱맞아서 불편했습니다. 잘신을게요. 이뻐여!",270,1,True,0,0,2024-08-18T21:29:57.000+09:00
71805064,4298289,5,신발 장시간걸어도 편하로 디자인도 이뻐서 만족하고 신고다니는편이에요,255,0,True,0,0,2025-03-06T12:36:47.000+09:00
71757619,4298289,5,제 사이즈가 없어서 10사이즈 크게 샀지만.. 엄청 가볍고 편합니다 넘넘 만족해요!!!,240,0,True,0,0,2025-03-05T00:03:36.000+09:00
71450863,4298289,5,진찌 발이 편하고 쫀쫀하게 걸을때 마다 붙어서 발에 부담도 덜해요. 디자인은 뭐 말할거 없이 이쁘고 너무 좋네요.,255,0,True,0,0,2025-02-23T15:52:32.000+09:00
71018472,4298289,5,"가볍고 엄청 편해서 거의 매일 신게
되요. 화이트도 있는데 겨울에 신으려고 하나 더삼. ㅎㅎ",240,0,True,0,0,2025-02-10T20:58:20.000+09:00
70567335,4298289,5,예쁩니다 볼이 작아서 업하는게 좋습니다 디자인 착용감 굿,290,0,True,0,0,2025-01-31T22:49:19.000+09:00
70123031,4298289,5,발 극도로 편하고 안전성을 느껴요 쿠션 정말 편안해서 오래 걸어도 안피곤하네요,285,0,True,0,0,2025-01-18T10:44:29.000+09:00
70102442,4298289,5,배송도 빠르고 착용감도 좋고 나름 만족스럽네요,255,0,True,0,0,2025-01-17T17:59:12.000+09:00
69965909,4298289,5,반업하니까 널널하고 편하네요 신발 신을때 발목을 잡아주니 안정감이 들어서 좋고 가벼워서 장시간 피로감도 덜할거 같아요,245,0,True,0,0,2025-01-14T09:51:53.000+09:00
69692377,4298289,5,편하고 좋습니다!! 평소 250 사이즈 신고 발볼 발등 보통인 사람인데 250 잘 맞아요!! 발등이 살짝 딱 맞긴 합니다,250,0,True,0,0,2025-01-06T17:37:22.000+09:00
69641911,4298289,5,편안하고 너무 푹신거리지도 안고 적당히 좋습니다  너무 비싸요..,255,0,True,0,0,2025-01-05T13:10:26.000+09:00
69588994,4298289,5,편하고 가볍습니다 할인을 못받아서 아쉽긴한데 편하니 좋네요,255,0,True,0,0,2025-01-03T21:30:04.000+09:00
69500017,4298289,5,"너무 예쁩니다
제 사이즈가 나와서 정말 행복해오
역시나 엄청 편하고 발목도 잘 잡아줘서 대만족이에오",280,0,True,0,0,2025-01-01T11:14:52.000+09:00
69237855,4298289,5,"선물했는데 좋아해서 매우 좋아요!
어제시키고 오늘왔어요!!쿠팡보다 ㅋㅋ 더하내여 ㅎㅎ
믿고사는 무신사!!! :) 
발이 생긴것보다 더 편하거 가볍대요!!
좋은 선물이 되었내요 ㅎㅎ",265,0,True,0,0,2024-12-23T20:42:53.000+09:00
69237822,4298289,5,"선물했는데 좋아해서 매우 좋아요!
어제시키고 오늘왔어요!!쿠팡보다 ㅋㅋ 더하내여 ㅎㅎ
믿고사는 무신사!!! :) 
발이 생긴것보다 더 편하거 가볍대요!!
좋은 선물이 되었내요 ㅎㅎ",265,0,True,0,0,2024-12-23T20:41:38.000+09:00
69052902,4298289,5,엄청 가볍네요 메쉬라 겨울엔 좀 춥습니다 쿠션감은 좋구요,275,0,True,0,0,2024-12-18T19:39:13.000+09:00
69052890,4298289,5,엄청 가볍네요 메쉬라 겨울엔 좀 춥습니다 쿠션감은 좋구요,275,0,True,0,0,2024-12-18T19:38:55.000+09:00
69034327,4298289,5,사이즈 반업하니 딱 맞네요 가볍고 편해서 좋습니다,270,0,True,0,0,2024-12-18T12:20:26.000+09:00
69002511,4298289,5,"생각 만큼 디자인 힙하고 아름다워요
나름 아저씨 느낌 잘어울리고 좋아요
착화감 굉장히 좋고 사이즈감도 발을 싹 감싸주니 좋습니다",285,0,True,0,0,2024-12-17T19:52:37.000+09:00
83843898,5360132,5,정사이즈로 샀는데 너무 잘산거 같아요 발볼도 불편함 없고 가벼워서 좋았어요,230,0,True,0,0,2026-04-27T20:18:55.000+09:00
83986800,5360132,5,실버 운동화 계속 찾고 있었는데 다들 뭔가 애매하던 찰나에 이게 눈에 들어왔어요. 실물이 색도 오묘하고 진짜진짜 예뻐요.,260,0,True,0,0,2026-04-26T22:53:04.000+09:00
83595462,5360132,5,생각보다 실물이 파란빛이 도는데 그게 맘에 듭니다! 실물이 더예쁘고 엄청 편하더라구요!! 추천합니다,260,0,False,0,0,2026-04-11T02:34:56.000+09:00
83030058,5360132,5,미즈노 신발 첫 구매인데 진짜 실물이 최곱니다!! 발도 완전 편해요,290,0,True,0,0,2026-03-17T23:34:59.000+09:00
80354410,5360132,5,색감이 너무 맘에 들고 편해요 흔하지 않아서 좋아요,275,0,False,0,0,2025-11-26T13:56:23.000+09:00
83980701,5888837,5,"이전에 신던 러닝화는 탄성이 좋은대신
발볼과 코가 짧아서 오래 뛰면 엄지발톱이 눌려서 아팠는데. 이 러닝화는 발볼과 엄지쪽까지
여유있어서 오래 뛰어도 발이 아프지 않고
매우 편하고 가볍네요!! 모양도 예쁘고
아직까지 때 타지 않고. 잘 신고있습니다.
가을엔 검정으로 한 번 더 살까해요^^",250,0,True,0,0,2026-04-26T19:12:24.000+09:00
83975466,5888837,5,"트레인 및 10km 정도 달리기용으로 구매
evo sl 추천도 있었지만 세일하길래^_^",245,0,True,0,0,2026-04-26T15:13:26.000+09:00
83942224,5888837,5,"매장에서 신어보고 정사이즈 구매했어요. 다른 러닝화는 240신는데 이것만 235신어요. 오늘 살짝 뛰어봤는데 반발력 적당한거같고 발바닥이 불편하지않아요. 
쿠션이 겉에서 만져봐도 말랑말랑하구 마시멜로같아요. 
발볼이 조금있는데 신발이 약간 좁아보여도 뛰는덴 지장없더라구요. 초보라 잘 모르겠음 ㅜㅜ
뛸때 불편하면 그냥 일상화로 신을려구 주문했는데 잘뛰어져서 만족합니다!! 14정도에 샀어요.",235,0,True,0,0,2026-04-24T23:58:57.000+09:00
83847170,5888837,5,"훈련화로 매우 좋음
아디제로 타쿠미센 아디프로 스트렁 다 보유 중인데 
부상 줄이는 단거리 트레이닝용으로는 보스턴 추천",245,0,True,0,0,2026-04-21T14:27:52.000+09:00
83812308,5888837,5,"발볼러들은 좀 불편할듯합니다.
긴 칼발이라 잘 맞아요
원래235-240신는데 240이 맞네요 
가볍고 괜찮아요",240,0,True,0,0,2026-04-19T22:59:55.000+09:00
83805165,5888837,5,"이쁩니다
카본화라 정말 가볍구요 러닝할때 잘 신어볼게요
올여름",240,0,True,0,0,2026-04-19T19:06:29.000+09:00
83163718,5888837,5,"편하게 잘 신었어요
디자인 성능 다 만족스럽ㄱ고 가벼워서 좋아요",245,0,True,0,0,2026-03-23T13:40:42.000+09:00
83738193,5888837,5,"진짜 평소에 트레킹화 신고 달렸더니 평균 페이스 7:20이었는데
러닝화 사자마자 6:10 됐어요 ; 그동안 왜 아무도 러닝화 사라고 안 함? 억울하네",250,0,True,0,0,2026-04-18T07:42:23.000+09:00
83518249,5888837,5,"데일리 트레이닝에 적합하게 내구성도 좋은데, 어느 정도 반발력도 있어 좋아요~",235,0,True,0,0,2026-04-07T22:40:09.000+09:00
83997406,5888837,5,"배송 당발이라 빨리받았어요
아디제로~굿 좋습니다",240,0,False,0,0,2026-04-27T12:46:46.000+09:00
83922242,5888837,5,"매우 가볍고 발목을 잘 잡아줌
생가보다 발볼도 넉넉해서 편함",245,0,False,0,0,2026-04-24T03:50:35.000+09:00
83719790,5888837,5,"학교에서 러닝배운다고해서 선물로 사줬는데, 맘에 들어 합니다. 운동을 딱히 좋아하진 않아서 안정감있는 거로 사줬어요.",245,0,False,0,0,2026-04-16T09:05:49.000+09:00
83397467,5888837,5,"아디다스 아디제로 보스턴 13 W 235 사이즈를 선물용으로 구매했는데, 디자인이 깔끔하면서도 기능성이 좋아 만족도가 높았습니다. 가벼운 무게 덕분에 장시간 착용해도 편하고, 쿠셔닝도 적당해서 러닝이나 일상 모두 활용하기 좋다고 합니다. 선물용으로 실용성과 디자인 모두 잡은 제품입니다.",235,0,False,0,0,2026-04-02T18:40:43.000+09:00
83397445,5888837,5,"아디다스 아디제로 보스턴 13 W 화이트/실버 230 사이즈를 선물했는데, 가볍고 착화감이 좋아서 운동할 때 정말 편하다고 합니다. 컬러도 깔끔해서 어떤 운동복에도 잘 어울리고, 러닝용으로 신기에 부담이 없다고 하네요. 발에 잘 밀착되는 느낌이라 안정감도 좋다고 만족해했습니다.",230,0,False,0,0,2026-04-02T18:40:14.000+09:00
83321611,5888837,5,가성비 너무 좋고 디자인도 예뻐요 정말 강력 추천합니다,255,0,False,0,0,2026-03-30T18:04:05.000+09:00
83604521,5888837,5,"와이프가 너무 좋아해요.
너무 잘달려진다고 합니다.",230,0,False,0,0,2026-04-11T16:10:00.000+09:00
83220950,3796833,5,"어머니 걷기 운동하실때 신으시라고 선물해 드렸습니다
발이 작고 얄상한 편이신데 많이 크지않고 편하고 좋다고 하시네요
아직 밖에 나가보진 않았지만 가볍고 좋은 거 같아요",BLU0_BLUE · 220,0,True,0,0,2026-03-25T21:36:24.000+09:00
77709283,3796833,5,매쉬 소재여서 여름에 통기성도 좋고 더운날에 잘 신고있어요,BLU0_BLUE · 235,0,True,0,0,2025-08-18T16:38:57.000+09:00
77188102,3796833,5,와이프 운동할 때 신으라고 선물했는데 이쁘고 가볍다고 좋아하네요. 저렴하게 잘 구입했습니다,BLU0_BLUE · 240,0,True,0,0,2025-07-27T21:33:50.000+09:00
59227924,3796833,5,딱 봄여름 시즌에 맞게 컬러도 화사하고 이뻐요～신발자체가 가볍고 착화감도 좋아요 너무 편하게 잘 신을거같아요!,BLU0_BLUE · 225,0,True,0,0,2024-05-11T13:46:44.000+09:00
77709381,3796833,5,색감도 여름용으로 잘 나와서 시원한 룩으로 신을 수 있어요,BLU0_BLUE · 250,0,True,0,0,2025-08-18T16:43:50.000+09:00
77300914,3796833,5,가벼우면서 쿠션감도 좋습니다.배송도 무지 빠르네요,BLU0_BLUE · 240,0,False,0,0,2025-07-31T21:15:18.000+09:00
59979948,3796833,4,배송빠르고 품질은 말할것도 없이 좋아요 무신사는 밑을만한 플랫폼이니까요,BLU0_BLUE · 255,0,False,0,0,2024-05-27T18:34:18.000+09:00
59223005,3796833,5,신발이 가볍고 착화감도 아주 좋아요～컬러도 화사한게 딱 여름에 신으면 이쁠거같아요!쿠폰까지 적용해서 저렴한 가격에 겟했습니다~전체적으로 너무 맘에 들어요!,BLU0_BLUE · 225,0,False,0,0,2024-05-11T11:58:22.000+09:00
