review_no,goods_no,grade,content,size_option,like_count,has_image,user_height,user_weight,created_at
83871992,5360123,5,"편하고 디자인도 이뻐서 어디든 잘 어울려요
특히 너무 가벼워서 오래 걸어도 발이 너무 편해요
사이즈는 발볼은 넓은데 길이는 정사이즈거나 살짝 작은거 같아요",250,0,False,0,0,2026-04-22T10:00:21.000+09:00
82836670,5360123,5,가볍고 편합니다  발볼넓게 나와서 불편하지 않네요,275,0,False,0,0,2026-03-09T20:51:47.000+09:00
83944920,5360123,5,"할인해서 샀어요 그
가격 만해요..무난하네여 고내찮아여",250,0,False,0,0,2026-04-25T07:11:01.000+09:00
78680200,5360123,4,"운동용이 아니라 데일리용으로 구매
점심먹고 간단히 산책 하기 가볍고 편함
가격 부담도 없이 휘뚜루마뚜르 신기 좋다 생각함
근데 가격이 싼만큼 외피 소재가 딱 그 가격 느낌으로 보임
근데 누가 발을 빤히 볼까요 색감 좋고 가격좋고 편하니 추천",280,0,False,0,0,2025-10-01T13:03:02.000+09:00
80518724,5360123,5,제가 신으려다가 좀 커서 엄마 선물해드렸는데 발볼이 넓어서 아주 마음에들어하시네여,235,0,False,0,0,2025-11-29T14:56:09.000+09:00
83643072,4171285,5,정사이즈 잘맞고 사진그대로 깔끔하니 예뻐요 편해서 데일리로 신기좋아요,(10)WHITE · 250,0,True,0,0,2026-04-13T10:11:01.000+09:00
83135486,4171285,5,나이키는 같은 사이즈여도 발볼이 좁은 느낌이면 뉴발은 훨씬 넉넉하네요. 뛰면서 발도 안 밀리고 좋았어요,(10)WHITE · 250,0,True,0,0,2026-03-22T09:53:17.000+09:00
82629520,4171285,3,"뉴발 530 을 신어보니, 가볍고 편해서.
런닝화 찾다가 이 제품을 구매 했어요~
봄이 다가 오니까, 하얀색을 신고 싶어서,
구매 했는데, 잘한거 같아오^^",(10)WHITE · 230,0,True,0,0,2026-02-28T16:07:41.000+09:00
81820151,4171285,5,"발바닥 신경통으로 약 복용 중이고, 무지외반증에 엄청난 칼발이며, 유연성 평발까지 있는 괴랄한 발의 소유자입니다. 이 때문에 아무 신발이나 못 신는데 뉴발란스가 확실히 신발을 잘 만드네요. 너무 푹신한 신발은 장기적으로 발에 좋지 않은데 적당히 반발력도 있고 쿠셔닝도 강하지 않아서 아주 좋습니다. 다만 아치를 잡아주는 기능은 전혀 없어서 따로 맞춤인솔 넣어 신고 있습니다. 디자인도 예쁘고 가성비 아주 좋네요.",(10)WHITE · 245,2,True,0,0,2026-01-23T14:23:42.000+09:00
81798509,4171285,5,처음에 오염있는거 와서 너무 열받았지만 교환해서 ㄱㅊ은거 받앗어요 엄청 가벼워서 잘 달릴수잇을거같음,(10)WHITE · 240,0,True,0,0,2026-01-22T13:46:50.000+09:00
79681777,4171285,5,엄니 선물해드렸는데 가볍고 편하다고 만족스러유ㅓ 하시네요.,(10)WHITE · 230,0,True,0,0,2025-11-08T12:27:51.000+09:00
78321886,4171285,5,착화감 가볍고 확실히 러닝할 때 도움이 됐어요. 걷기보다 뛸 때 더 가벼운 느낌이라 러닝을 좀 더 쉽고 재밌게 즐길 수 있어요..,(10)WHITE · 240,2,True,0,0,2025-09-15T11:03:59.000+09:00
78459270,4171285,4,"런닝화로 신으려고 구매했는데 너무 가볍고 편안해요
쿠션감도 좋아서 오래 뛰어도 발이 아프지 않아서 좋아요
잘 산듯합니다!!",(10)WHITE · 220,1,True,0,0,2025-09-21T16:18:41.000+09:00
75350691,4171285,4,디자인도 예쁘고 엄청 딱딱하지도 않아서 신기 좋아요,(10)WHITE · 240,1,True,0,0,2025-06-15T22:03:21.000+09:00
83950718,4171285,5,가격대비 디자인이나 편안한 거까지 다 너무 좋아여 그냥 아무거나 입고 신어도 무난하고 발이 너무 편함!!,(10)WHITE · 235,0,False,0,0,2026-04-25T13:37:45.000+09:00
83781351,4171285,5,딸에게 사줬더니 아주 편하고 가벼워서 좋다고 하네요,(10)WHITE · 240,0,False,0,0,2026-04-18T19:03:35.000+09:00
83776393,4171285,5,어디에나 잘어울려요 기본템으로 아주 좋아요 강추용,(10)WHITE · 250,0,False,0,0,2026-04-18T15:40:28.000+09:00
78389472,4171285,5,"러닝할때 신을 운동화를 찾다가
뉴발 런닝화를 발견하고 주문했습니다ㅎ
검정 런닝화만 신다가 새하얀 런닝화를 
신으니 밝고 예쁩니다!!ㅎ
신었을때 무게는 너~무 가볍습니다!!
달렸을때 쿠션감이 적당히 있어 
지면에 닿을때 충격도 크지 않고~
무엇보다 뛸때 정말 가벼워서
좋았네요~~!!^^",(10)WHITE · 230,0,True,0,0,2025-09-18T10:44:36.000+09:00
77904028,4171285,5,신발편하고 이뻐요 뉴발은 평타이상은하니까 사이즈만 맞으면 아무거나사도될거같아요,(10)WHITE · 240,0,True,0,0,2025-08-27T18:55:55.000+09:00
77479712,4171285,5,너무 마음에 들어요! 쿠션도 짱짱하고 제가 발볼이 넓어서 뉴발란스 신발이 편하더라고요.,(10)WHITE · 245,0,True,0,0,2025-08-07T17:47:09.000+09:00
77459975,4171285,5,선물드렸는데ㅜ너무 좋아하시고 편안하다합니다 준사람 받는분 모두만족할만한 상춤이었어요 사이즌 ㄴ5미리 큰게 나을듯하네요. 딱 좋아하네요..,(10)WHITE · 235,0,True,0,0,2025-08-06T21:44:06.000+09:00
77108515,4171285,5,"좋아요. 실내 러닝하기에 편한 것 같아요. 착화감도 좋고 발길이 24cm, 발볼 8cm에 240 사이즈 괜찮아요. 다 나쁘지 않은데 신발 상자가 파손되고 찢긴 종이 비닐로 포장된 건 좋지 않았어요. 반품된 제품을 받은 기분이었는데, 다행히 신발은 새 것 느낌이 나서 그냥 신어요",(10)WHITE · 240,0,True,0,0,2025-07-24T21:04:54.000+09:00
76653013,4171285,5,"정말 가볍고 발을 잘 잡아줘서 너무 좋아요! 일상에서도, 운동할 때도 신기 좋습니다!",(10)WHITE · 240,0,True,0,0,2025-07-09T20:33:39.000+09:00
76532090,4171285,5,가볍고 편해서 샀는데 무신사가 가장 저렴하네요,(10)WHITE · 240,0,True,0,0,2025-07-06T13:04:10.000+09:00
76138487,4171285,4,매장에서 보고 구입했어요 엄청 가벼워서 여름에 신기 좋아요,(10)WHITE · 245,0,True,0,0,2025-06-27T08:27:08.000+09:00
83908088,5173980,5,"발볼이 넓은편입니다!!
M255 아주 편하게  신는데
W255라 그건지 확실히 발볼이 좁아요
길이도 그냥 데일리화로 신기앤 괜찮은데
러밍하기엔 발끝이.살짝 딯아서 좀 불편합니다
그래도 가볍고 걷는데는 문제없어서 잘 신겠습니다",255,0,True,0,0,2026-04-23T16:22:17.000+09:00
83901193,5173980,5,편하고 예뻐서 좋아요  디른 색도 사고 싶어요  좋아요,250,0,True,0,0,2026-04-23T10:56:13.000+09:00
83862896,5173980,5,"러닝머신 하려고 샀어요 발목을 꽉 잡아주고
미끄럽지 않고 착화감도 아주가볍고 좋네요",245,0,True,0,0,2026-04-22T16:59:38.000+09:00
83867539,5173980,5,이거 신고 페이스가 엄청 줄었어요 !! 러닝화의 중요성을 알게 된 신발입니다 ㅠㅠ 착지할 때 불편함도 없고 발목이 아파서 러닝을 할 때마다 힘들었는데 이거 신으니까 발목도 덜 아파요 ! 보메로 너무 조아요 .. 🤍,245,0,True,0,0,2026-04-22T01:49:51.000+09:00
83862790,5173980,5,"정240사이즈인데 한사이즈 업했어요
245시켰는데 엄지 살짝 남는데 아주좋아요
첫날은 새신 신고 기분이 좋아서인지 완전
발이 너무 가볍고 좋더라구요~
굿입니다!!",245,0,True,0,0,2026-04-21T22:42:06.000+09:00
83806751,5173980,5,"신이 가볍고 쿠션감이 좋아용
러닝화는 처음 사보는데 확실히 푹신푹신 하네용 
얼른 신고 뛰어보고싶어요
디자인도 이뻐용ㅎ",230,0,True,0,0,2026-04-19T20:11:09.000+09:00
83787651,5173980,5,러닝 목적으로 구입했어요. 뉴발 1080 신고 있는데 신은 느낌은 비슷한데 이 제품이 조금 더 가벼워요. 후기대로 조금 작게 나왔다고 해서 보통 240 신는데 245로 주문했고 잘 맞네요.,245,0,True,0,0,2026-04-18T23:24:47.000+09:00
83744836,5173980,5,디자인도 예쁘고 굽도 높아서 예쁘고요 쿠션감도 좋네요,235,0,True,0,0,2026-04-17T15:32:55.000+09:00
83744567,5173980,5,"푹신푹신한 착화감이 너무 좋아요
발볼과 넓이도 좋아요",235,0,True,0,0,2026-04-17T08:57:53.000+09:00
83717483,5173980,5,깔끔하고 쿠션감도 좋습니다. 러닝화로 좋을 것 같아요 추천합니다.,245,0,True,0,0,2026-04-16T02:38:03.000+09:00
83649887,5173980,5,러닝 입문자용으로 구입했어요 반치수 크게 주문했구요 그렇게 크지도 않고 적당합니다 쿠션도 좋고 가벼워서 좋네요 열심히 달려보려구요^^,245,0,True,0,0,2026-04-13T16:34:54.000+09:00
83698989,5173980,4,임산부라 한치수 크게 샀는데 살짝커요. 편하고 젛아요,250,1,True,0,0,2026-04-15T14:23:37.000+09:00
76988200,5173980,5,런닝화는 처음 사보는데 확실히 다른 것 같아요 페가수스보다 쿠션이 더 많아서 통통잘튀어요. 발목도 잘 잡아줘서 만족합니다!,245,3,True,0,0,2025-07-21T00:30:55.000+09:00
83781593,5173980,5,엄마사드렸는데 편하다구하네요 잘신을거같아요,240,0,True,0,0,2026-04-18T19:12:41.000+09:00
83672402,5173980,5,첫 러닝화에용 러닝화가 예뻐서 평상시에도 잘 신고있어요,225,0,True,0,0,2026-04-14T16:01:21.000+09:00
78083779,5173980,5,"쿠션이 높고 푹신해서 발이 편해요. 
러닝화 말고 일상화로도 잘 신을 수 있을 것 같아요.",240,1,True,0,0,2025-09-04T12:30:03.000+09:00
77589814,5173980,5,좋아요 엄청 푹신해요 발볼은 넓지는 않아서 235-240 신는데 245시켰어요,245,1,True,0,0,2025-08-12T16:23:32.000+09:00
83967503,5173980,5,"러닝화는 나이키만신게 되네요^^
디자인 깔끔하고 쿠션도 괜찮아요~",240,0,False,0,0,2026-04-26T04:28:00.000+09:00
83733553,5173980,5,굽이높아서 신발신고 일어날때 조심해야겠어요.디자인예쁘고 쿠션도좋아요,235,0,False,0,0,2026-04-16T19:55:19.000+09:00
78354902,5173980,4,할인받아 구매해서 와이프 선물로 줬는데~~ 폭신하니 편하고 좋대요~~~^^,245,0,True,0,0,2025-09-16T22:07:48.000+09:00
83669539,3863542,4,운동 할 때 신으면 되게 잘 어울리는 그런 스타일이에요. 디자인도 예쁘고 착용감도 나쁘지 않아서 만족합니다.,280,1,True,0,0,2026-04-14T13:55:03.000+09:00
83669474,3863542,4,일단 디자인과 가격이 마음에 들어서 샀는데 직접 받아 보니까 디자인이 되게 유니크하고 예쁘다는 생각이 들었어요. 착화감은 다른 비싼 신발 보다는 조금 별로지만. 그래도 이정도면 가격대비 꽤나 만족합니다.,280,1,True,0,0,2026-04-14T13:50:55.000+09:00
83820589,3863542,5,"운동화 잘 받았어요!

가격도 부담 없고 착화감도 정말 편해서 만족스럽네요. 파란색 조합이 깔끔해서 어떤 스타일에도 잘 어울리는 것 같아요. 전체적으로 아주 만족스러운 구매였습니다",275,0,True,0,0,2026-04-20T10:30:30.000+09:00
83820559,3863542,5,"운동화 잘 받았어요!

가격도 부담 없고 착화감도 정말 편해서 만족스럽네요. 파란색 조합이 깔끔해서 어떤 스타일에도 잘 어울리는 것 같아요. 전체적으로 아주 만족스러운 구매였습니다",275,0,True,0,0,2026-04-20T10:29:17.000+09:00
83376696,3863542,4,"재구매 신발입니다.
신고 보니 가격 대비 너무 좋아서 2컬레 더 구매합니다",280,0,True,0,0,2026-04-01T21:49:42.000+09:00
83350925,3863542,5,"핏 딱 되고 
가볍고  
딱 조아오 마라톤 나갈려고 샀음 굿 추천",230,0,True,0,0,2026-03-31T23:05:21.000+09:00
82917376,3863542,5,"볼이 작게안나와서 너무좋았습니다
길이보다는 볼에 맞혀야하는데 평상시 신는 사이즈 딱좋아요
색상도이쁘고  어디에다가 코디해도 다이쁨니다
봄.여름신기 좋을듯요",270,0,True,0,0,2026-03-17T15:44:54.000+09:00
82917363,3863542,5,"런닝할때  가볍게 신고다니는데 너무좋아요
신발을 볼에 맞혀서 신는데 불편한거없이 좋습니다",270,0,True,0,0,2026-03-13T08:08:14.000+09:00
82272316,3863542,5,가성비 너무 좋게 구매하였고 전투용으로 자주 잘 신고 있네요,265,0,True,0,0,2026-02-14T22:10:19.000+09:00
82112066,3863542,5,"친구가 사서 따라샀습니다
편하고 좋아요 강추입니다",270,0,True,0,0,2026-02-07T19:11:03.000+09:00
81135855,3863542,5,상품 받고 신어보니 착용감이 좋아 편하고 좋네요,270,0,True,0,0,2025-12-20T14:48:56.000+09:00
80410704,3863542,5,"반사이즈 업해서 구매했는데 잘 맞았습니다
발볼이 큰편인분들은 반~한업 하시는걸 고려해보면
도움될거같습니다",270,0,True,0,0,2025-11-27T10:58:35.000+09:00
80404273,3863542,4,파랑색 라인 디자인이 조금 과하나 신다면 신다보면 포인트가 될듯 합니다,280,0,True,0,0,2025-11-27T08:02:06.000+09:00
83347494,3863542,5,실내 운동용으로 구입했는데 편하고 쿠션도 있어서 좋아요.,275,0,False,0,0,2026-03-31T21:29:47.000+09:00
82112077,3863542,5,"제가 샀는게 친구가 똑같은거 사서 화납니다
근데 편해요",280,0,True,0,0,2026-02-07T19:11:42.000+09:00
69048663,3863542,4,좋아요 파란색이랑 은색 포인트가 있어서 맘에 들어요,270,1,True,0,0,2024-12-18T18:06:01.000+09:00
58204395,3863542,5,"다른브랜드식상해서,오랜만에리복신발중에맘에드는프리미어로드플러스구입했어요.
색상때문에무지고민했는데,블루색깔이쁩니다.
아웃솔도흰색아니고살짝에이징된느낌의색이구요.매쉬부분도새하얗진않고,살짝그레이느낌이에요.

사이즈업하란얘기가많은데,평소에발등이높은편이아니면,정사이즈로충분할것같아요.
평소아식스265신어서..270도편하지만,265도충분했을것같아요.발볼이좁다기보단신발입구랑,발등이좀타이트하네요.
신발무지가볍고,블루이쁩니다.
와이드핏보다는,통이적당한스트레이트핏바지나,파라슈트팬츠랑잘어울릴것같아요",270,1,True,0,0,2024-04-19T21:20:49.000+09:00
58204321,3863542,5,"다른브랜드식상해서,오랜만에리복신발중에맘에드는프리미어로드플러스구입했어요.
색상때문에무지고민했는데,블루색깔이쁩니다.
아웃솔도흰색아니고살짝에이징된느낌의색이구요.매쉬부분도새하얗진않고,살짝그레이느낌이에요.

사이즈업하란얘기가많은데,평소에발등이높은편이아니면,정사이즈로충분할것같아요.
평소아식스265신어서..270도편하지만,265도충분했을것같아요.발볼이좁다기보단신발입구랑,발등이좀타이트하네요.
신발무지가볍고,블루이쁩니다.
와이드핏보다는,통이적당한스트레이트핏바지나,파라슈트팬츠랑잘어울릴것같아요",270,3,True,0,0,2024-04-19T21:19:17.000+09:00
65823658,3863542,5,발 진짜 편하네요 가성비 좋게 마련햇습니다 흔치 않아서 조아요,245,0,True,0,0,2024-10-21T19:21:13.000+09:00
60296946,3863542,5,신발 가볍고 여름에 파란색 들어간 신발사고싶어서 사봤는데 편하고 좋아요,240,0,True,0,0,2024-06-03T13:47:50.000+09:00
83444141,4852386,4,"평소230 신는데 정사이즈 같아요.발볼 넓으신분들도 편하게 신을수 있으며 접지력도 매우 좋고 메시 소재로 여름철에도 시원하게 신을수있습니다.
상당히 가볍습니다.",IVORY · 230MM,0,True,0,0,2026-04-13T13:58:19.000+09:00
83895211,4852386,5,엄마 봄여름 신발 없어서 주문해 드렸는데 넘넘 맘에 들어 하셔요!!!! 예쁘다고 계속 신고 계시네욬ㅋㅋ,IVORY · 230MM,0,True,0,0,2026-04-23T00:33:23.000+09:00
82950022,4852386,5,엄청 가벼워요! 그냥 가성비로 헬스장 러닝머신뛸때 신으려고 산건데 가볍고 좋아요! 운동화 235신는데 정사이즈 추천!!,IVORY · 235MM,1,True,0,0,2026-03-14T17:42:52.000+09:00
82187588,4852386,5,알바하면서 계속 서 있으니까 빌이 쉽게 피로해지더라구요. 그러다가 운동화 세일하길래 바로 겟! 저는 한치수 크게 샀는데 정사이즈여도 넉넉할 것 같더라구요. 눈길에도 미끄러짐 없었고 가벼워서 오래 신어도 편하고 좋았어용~~헤헤 글고 메쉬로 되어있어서 통풍도 잘 됨!,IVORY · 255MM,1,True,0,0,2026-02-21T21:30:36.000+09:00
79716387,4852386,5,"제가 평발쪽이고 발볼이 넓어서 그런지 웬만한 운동화들은 발이 다아픈데
이건 안아퍼서 운동하거나 자주 걸어다녀야할때 많이 신어요!
색도 무난무난하니 잘신을듯
10키로마라톤 뛰고 발안아팠움",IVORY · 250MM,4,True,0,0,2025-11-09T23:46:24.000+09:00
80266175,4852386,5,"운동화 색깔이 예상이라는 달랐어요
하영색보다는 아이보리 색에 가까워서 사실때 참고하세요",IVORY · 250MM,3,True,0,0,2025-11-24T22:13:36.000+09:00
83285659,4852386,5,노스페이스 신발은 처음인데요. 생각보다 쿠션감도 좋고 데일리로 자주 신게 되더라구요. 디자인도 괜찮았어요. 다음에 할인들어갈때 또 사야겠어요. 좋아용,IVORY · 240MM,0,True,0,0,2026-03-28T21:54:11.000+09:00
83216400,4852386,5,가볍고 편하고 이뻐요!! 아직 밖에서 신어보진 않았지만 대충 걸었을깨 괜찮은것같아요,IVORY · 235MM,0,True,0,0,2026-03-25T19:02:00.000+09:00
83022192,4852386,5,"이 신발은 디자인도 예쁘고 착화감이 정말 편안해요. 오래 걸어도 발이 아프지 않고, 색상도 화면 그대로라 만족합니다.",IVORY · 240MM,0,True,0,0,2026-03-17T20:18:21.000+09:00
82662860,4852386,5,"가벼운 무게감,편안한 착용감 스타일까지 모두 맘에들어요~^^",IVORY · 230MM,0,True,0,0,2026-03-02T00:38:36.000+09:00
82610562,4852386,5,"운동화가 딱딱하지않아서 좋아요.딱딱한운동화신고 운동하니 아킬레스건쪽이 너무아파서 운동화바꾸려고 샀는데 마침 사이즈 하나 남은거 빨리 구매했는데 너무 편하고 좋아요
럭키비키!!",IVORY · 250MM,0,True,0,0,2026-02-27T18:47:42.000+09:00
82500050,4852386,5,"발볼도 편하구요  무겁지않아서 좋네요.
가볍고 신어봤는데 편해요
좋아요",IVORY · 240MM,0,True,0,0,2026-02-23T21:38:01.000+09:00
82218948,4852386,4,무게가 가벼울거라 생각했는데 막 생각한만큼 가볍지는 않아요 ㅎㅎ 그리고 생각보다 발바닥 부분이 딱딱하더라구요 보이는거랑 좀 느낌이 달랐습니다 그치만 가격이 싸서 괜찮은거같아요,IVORY · 250MM,0,True,0,0,2026-02-12T18:44:49.000+09:00
77763371,4852386,5,사진은 예쁜데 실물은 좀 안예쁨. 근데 또 신으면 괜찮음. 멀리서 보면 예쁘고 자세히 보면 웃김. 폭신폭신 편하고 신발도 끈도 재질이 발을 꽉 쪼이는 느낌이 아니고 발을 샥 감싸듯 부드러워요. 굿,IVORY · 250MM,6,True,0,0,2025-08-20T22:53:44.000+09:00
80917166,4852386,5,"발볼이 넓은 235라서 항상 240사이즈 사는데
이거는 볼이 넉넉하게 나와서 그냥 원래사이즈로 사도 될거같아요~
근데 신발이 박스가 아닌 비닐에 담겨오는건 크록스 말고 처음임...그건좀 그래요 ㅠ
다음엔 정사이즈로 구매예정!",IVORY · 240MM,1,True,0,0,2025-12-11T16:45:05.000+09:00
80874501,4852386,5,"너무 가볍고 좋아용!
헬스장에서 런닝 할때 신으려고 샀어요~ 
정말 잘 산것 같아요",IVORY · 230MM,0,True,0,0,2025-12-10T09:29:24.000+09:00
81396435,4852386,5,런닝화라 가볍고 편한데 겨울에는 바람이 슝슝 들어와서 추워요. 여름 혹은 실내용 운동화로 추천,IVORY · 245MM,0,True,0,0,2026-01-02T12:45:50.000+09:00
81293633,4852386,5,푹신할거란 기대와 다르게 밑창는 좀 딱딱한 느낌입니다. 그런데 발은 안아파요! 신을만 하고 디자인이 예쁘네요. 아이보리에 실버가 은근 잘 어울려요 정사이즈로 신으면 될 거 같아요 좋습니다.,IVORY · 230MM,0,True,0,0,2025-12-27T23:39:08.000+09:00
81092035,4852386,5,쿠션감 좋고 흰색이 아닌 아이보리가 섞여있어서 당황했지만 신다보니 괜찮았어요,IVORY · 230MM,0,True,0,0,2025-12-18T13:46:31.000+09:00
80944412,4852386,5,키가 커보이고 신발이 편해요 발볼 넓은 사람들이 신으면 더 좋을것같아요,IVORY · 230MM,0,True,0,0,2025-12-12T15:26:46.000+09:00
74102720,4344805,5,처음엔 푹신하고 걷기 편했는데 비오는 날에 미끄러지기 너무 쉬워요 발목 접지를 뻔 했는데 오래(만 보 이상) 걷기는 힘들 것 같아요,250,5,True,0,0,2025-05-12T13:26:06.000+09:00
74104964,4344805,5,푹신한데 발볼이 좀 좁은 신발이라 제대로 안 걷는 사람들은 발목이 잘 꺾여요,250,3,True,0,0,2025-05-12T14:40:44.000+09:00
81838350,4344805,5,일단처음으로 쿠션이 다른신발착용감보다 다르다고 느꼈어요 정말 가성비 고급신발이라 생각해요,270,0,True,0,0,2026-01-24T13:48:12.000+09:00
81838301,4344805,5,디자인도 무난해서 이쁘고 안쪽이 갈색이라 뭔가 고급진느낌도 있습니다,270,0,True,0,0,2026-01-24T13:46:00.000+09:00
81463942,4344805,5,운동할 때 신으려고 산건데 그럭저럭 괜찮습니다 저렴해서 좋았어요,230,0,True,0,0,2026-01-05T16:39:45.000+09:00
81463930,4344805,5,저렴해서 구매했어요 운동할때쓰려고 샀는데 그럭저럭 괜찮습니다 발 패드쪽이 좀 미끄러운것빼고는...,230,0,True,0,0,2026-01-05T16:38:54.000+09:00
81434328,4344805,5,"신발이 예쁘고 착용감도 무겁지 않아
운동할 때 좋습니다 또한 오래 신어도 아프지 않아요",280,0,True,0,0,2026-01-04T01:13:04.000+09:00
79554566,4344805,5,가볍고 색상 및 디자인이 튀지 않아서 옷과 매치하기도 쉬워요.,230,0,True,0,0,2025-12-11T17:03:25.000+09:00
80837496,4344805,5,"미끄럼도 없으며 여러활동할때도 신기 편해요. 
고프코어느낌의 신발찾으시는 분들에게 추천해요",280,0,True,0,0,2025-12-08T23:10:48.000+09:00
79406201,4344805,1,"발바닥 높이 짝짝이에요.
막 신으려고 구매한거지만
짝짝이가 심해서 이런 수평 심각함 처음이에요",260,2,True,0,0,2025-10-28T21:46:11.000+09:00
77266026,4344805,5,발바닥이 편안해서 오래 걸을 수 있어 좋아요 잘신을게요~,270,2,True,0,0,2025-07-30T17:14:22.000+09:00
83868779,4344805,4,비 오는 날 여러 번 죽을 뻔햣어요 실내 헬스용 추천,240,0,True,0,0,2026-04-22T06:27:01.000+09:00
76611460,4344805,5,"검정색 신발 필요해서 샀는데
찐한 검정이여서 좋고
무엇보다 쫙 잡아주는 안감과
바닥에 쿠션감이 매우 좋아요.
사이즈 좀 널 널한거 좋아하심
제가 255 -260와따갔다하는데
260이 딱 감아주더라고요. 참고하세요.",260,1,True,0,0,2025-07-08T18:48:29.000+09:00
83909131,4344805,5,런닝을 자주 뛰는 게 아니라 가끔씩 뛰어서 런닝화를 살까 말까 고민하고 있었는데 세일하길래 가성비 좋게 구매했어요! 신고 뛰어보니까 확실히 발이 가벼워서 좋은 것 같아요,240,0,False,0,0,2026-04-23T17:08:53.000+09:00
83666169,4344805,5,핼스장에서 신을려고 샀는데 편하고 가볍고 좋아오,260,0,False,0,0,2026-04-14T10:49:13.000+09:00
79053489,4344805,5,"신발 밑창에 쿠션이 있어서 매우 푹신합니다. 가격대비 디자인이 생각보다 깔끔해서 놀랐구요, 무엇보다 상자가 정말 예쁩니다.",260,0,True,0,0,2025-10-16T01:46:20.000+09:00
79010877,4344805,5,가격 대비 너무가볍고 적당한 쪼임감에 놀랬어요,270,0,True,0,0,2025-10-14T22:22:38.000+09:00
75536533,4344805,2,신발 앞뒤차가 있어서 하이힐이나 키높이 깔창을 신은 느낌이네요. 착용감은 괞찮은데 쿠션이 딱딱하네요.,270,0,True,0,0,2025-06-18T18:57:26.000+09:00
75182699,4344805,5,발볼있으면 5업하면좋아요.맘억듭니당~^^무신사에서싸게겟하네요.,240,0,True,0,0,2025-06-11T00:58:20.000+09:00
73852316,4344805,4,신발이 편하고 좋아요 자주 신고 다닐꺼 같아요 푹신푹신해요,240,0,True,0,0,2025-05-05T13:31:52.000+09:00
82333277,4441361,5,"착용감
	•	신발이 가벼워서 장시간 착용해도 발에 피로감이 적습니다.
	•	발을 적당히 감싸주는 핏으로, 걸을 때 안정감 있으면서도 편안합니다.
	•	고무 아웃솔이 충격 흡수가 좋아 울퉁불퉁한 지형에서도 안정적인 보행을 도와줍니다.
	•	가벼운 등산, 트레킹, 캠핑, 장거리 워킹에 적합합니다.
	•	깔끔한 디자인과 매치하기 쉬운 컬러 덕분에 데일리 아웃도어 슈즈로도 활용 가능합니다.",B-4라이트그레이 · 240,0,True,0,0,2026-02-18T13:43:38.000+09:00
83009413,4441361,5,쿠션감이 너무 좋고 발이 편해서 엄청 자주 신어요 ! 허리디스크 증상도 이거 신고 덜 한 거 같기도해요,B-1블랙 · 250,0,True,0,0,2026-03-17T11:08:49.000+09:00
80857623,4441361,4,"러닝하려고 구매했어요
러닝화는 항상 반업해요
달리다보면 발가락이 붓더라구요
살짝여유있게 사니 편하고좋네요",B-1블랙 · 245,1,True,0,0,2025-12-09T19:10:18.000+09:00
77722173,4441361,4,너무 편하네요~와이드라 발볼넓어도 낭낭하고 블랙이라 런닝외에도 데일리로 신고 다녀도 좋을거같아요.사이즈는 반 더운 하시는게 나을거 같아요~ 커요. 그치만 스포츠 같은 두꺼운 양말신음 그냥저냥 맞을거 같아요.,B-1블랙 · 245,3,True,0,0,2025-08-19T09:30:56.000+09:00
